<!ELEMENT PersonalInfo (RollNo,Name,Address,MobileNo,DOB,Age,Qualification)>	
<!ELEMENT RollNo (#PCDATA)>
<!ELEMENT Name (#PCDATA)>
<!ELEMENT Address (#PCDATA)>
<!ELEMENT MobileNo (#PCDATA)>
<!ELEMENT DOB (#PCDATA)>
<!ELEMENT Age (#PCDATA)>
<!ELEMENT Qualification (#PCDATA)>
